{
  "$schema": "https://json-schema.org/draft/2020-12/schema",
  "$id": "https://xcodebuildmcp.com/schemas/structured-output/xcodebuildmcp.output.process-list/2.schema.json",
  "type": "object",
  "additionalProperties": false,
  "allOf": [
    {
      "$ref": "https://xcodebuildmcp.com/schemas/structured-output/_defs/common.schema.json#/$defs/errorConsistency"
    }
  ],
  "properties": {
    "schema": {
      "const": "xcodebuildmcp.output.process-list"
    },
    "schemaVersion": {
      "const": "2"
    },
    "didError": {
      "type": "boolean"
    },
    "error": {
      "type": [
        "string",
        "null"
      ]
    },
    "data": {
      "type": "object",
      "additionalProperties": false,
      "properties": {
        "summary": {
          "type": "object",
          "additionalProperties": false,
          "properties": {
            "runningProcessCount": {
              "type": "integer",
              "minimum": 0
            }
          },
          "required": [
            "runningProcessCount"
          ]
        },
        "processes": {
          "type": "array",
          "items": {
            "type": "object",
            "additionalProperties": false,
            "properties": {
              "name": {
                "type": "string"
              },
              "processId": {
                "type": "integer",
                "minimum": 1
              },
              "uptimeSeconds": {
                "type": "integer",
                "minimum": 0
              },
              "artifacts": {
                "type": "object",
                "additionalProperties": false,
                "properties": {
                  "packagePath": {
                    "type": "string"
                  }
                },
                "required": [],
                "minProperties": 1
              }
            },
            "required": [
              "name",
              "processId",
              "uptimeSeconds"
            ]
          }
        }
      },
      "required": [
        "summary",
        "processes"
      ]
    },
    "nextSteps": {
      "$ref": "https://xcodebuildmcp.com/schemas/structured-output/_defs/common.schema.json#/$defs/nextSteps"
    }
  },
  "required": [
    "schema",
    "schemaVersion",
    "didError",
    "error",
    "data"
  ]
}
